<?xml version="1.0" encoding="UTF-8"?>
<dataroot xmlns:od="urn:schemas-microsoft-com:officedata" xmlns:xsi="http://www.w3.org/2001/XMLSchema-instance"  xsi:noNamespaceSchemaLocation="10_Instruments.xsd" generated="2026-06-30T12:12:49">
<_x0031_0_Instruments>
<InstrumentID>1</InstrumentID>
<InstrumentName>RCADS-47-Y-EN</InstrumentName>
<InstrumentFamily>1</InstrumentFamily>
<Language>1</Language>
<Informant>1</Informant>
<Deprecated>0</Deprecated>
<Authorized>1</Authorized>
<ReadRighttoLeft>0</ReadRighttoLeft>
<Unavailable_x0028_NotGenerated_x0029_>0</Unavailable_x0028_NotGenerated_x0029_>
</_x0031_0_Instruments>
<_x0031_0_Instruments>
<InstrumentID>2</InstrumentID>
<InstrumentName>RCADS-47-CG-EN</InstrumentName>
<InstrumentFamily>1</InstrumentFamily>
<Language>1</Language>
<Informant>2</Informant>
<Deprecated>0</Deprecated>
<Authorized>1</Authorized>
<ReadRighttoLeft>0</ReadRighttoLeft>
<Unavailable_x0028_NotGenerated_x0029_>0</Unavailable_x0028_NotGenerated_x0029_>
</_x0031_0_Instruments>
<_x0031_0_Instruments>
<InstrumentID>3</InstrumentID>
<InstrumentName>RCADS-25-Y-EN</InstrumentName>
<InstrumentFamily>1</InstrumentFamily>
<Language>1</Language>
<Informant>1</Informant>
<Deprecated>0</Deprecated>
<Authorized>1</Authorized>
<ReadRighttoLeft>0</ReadRighttoLeft>
<Unavailable_x0028_NotGenerated_x0029_>0</Unavailable_x0028_NotGenerated_x0029_>
</_x0031_0_Instruments>
<_x0031_0_Instruments>
<InstrumentID>4</InstrumentID>
<InstrumentName>RCADS-25-CG-EN</InstrumentName>
<InstrumentFamily>1</InstrumentFamily>
<Language>1</Language>
<Informant>2</Informant>
<Deprecated>0</Deprecated>
<Authorized>1</Authorized>
<ReadRighttoLeft>0</ReadRighttoLeft>
<Unavailable_x0028_NotGenerated_x0029_>0</Unavailable_x0028_NotGenerated_x0029_>
</_x0031_0_Instruments>
<_x0031_0_Instruments>
<InstrumentID>5</InstrumentID>
<InstrumentName>RCADS-47-Y-DE</InstrumentName>
<InstrumentFamily>1</InstrumentFamily>
<Language>9</Language>
<Informant>1</Informant>
<Deprecated>0</Deprecated>
<Authorized>1</Authorized>
<ReadRighttoLeft>0</ReadRighttoLeft>
<Unavailable_x0028_NotGenerated_x0029_>0</Unavailable_x0028_NotGenerated_x0029_>
</_x0031_0_Instruments>
<_x0031_0_Instruments>
<InstrumentID>6</InstrumentID>
<InstrumentName>RCADS-47-CG-DE</InstrumentName>
<InstrumentFamily>1</InstrumentFamily>
<Language>9</Language>
<Informant>2</Informant>
<Deprecated>0</Deprecated>
<Authorized>1</Authorized>
<ReadRighttoLeft>0</ReadRighttoLeft>
<Unavailable_x0028_NotGenerated_x0029_>0</Unavailable_x0028_NotGenerated_x0029_>
</_x0031_0_Instruments>
<_x0031_0_Instruments>
<InstrumentID>7</InstrumentID>
<InstrumentName>RCADS-25-Y-DE</InstrumentName>
<InstrumentFamily>1</InstrumentFamily>
<Language>9</Language>
<Informant>1</Informant>
<Deprecated>0</Deprecated>
<Authorized>1</Authorized>
<ReadRighttoLeft>0</ReadRighttoLeft>
<Unavailable_x0028_NotGenerated_x0029_>0</Unavailable_x0028_NotGenerated_x0029_>
</_x0031_0_Instruments>
<_x0031_0_Instruments>
<InstrumentID>8</InstrumentID>
<InstrumentName>RCADS-25-CG-DE</InstrumentName>
<InstrumentFamily>1</InstrumentFamily>
<Language>9</Language>
<Informant>2</Informant>
<Deprecated>0</Deprecated>
<Authorized>1</Authorized>
<ReadRighttoLeft>0</ReadRighttoLeft>
<Unavailable_x0028_NotGenerated_x0029_>0</Unavailable_x0028_NotGenerated_x0029_>
</_x0031_0_Instruments>
<_x0031_0_Instruments>
<InstrumentID>9</InstrumentID>
<InstrumentName>RCADS-47-Y-DA</InstrumentName>
<InstrumentFamily>1</InstrumentFamily>
<Language>4</Language>
<Informant>1</Informant>
<Deprecated>0</Deprecated>
<Authorized>1</Authorized>
<ReadRighttoLeft>0</ReadRighttoLeft>
<Unavailable_x0028_NotGenerated_x0029_>0</Unavailable_x0028_NotGenerated_x0029_>
</_x0031_0_Instruments>
<_x0031_0_Instruments>
<InstrumentID>10</InstrumentID>
<InstrumentName>RCADS-47-CG-DA</InstrumentName>
<InstrumentFamily>1</InstrumentFamily>
<Language>4</Language>
<Informant>2</Informant>
<Deprecated>0</Deprecated>
<Authorized>1</Authorized>
<ReadRighttoLeft>0</ReadRighttoLeft>
<Unavailable_x0028_NotGenerated_x0029_>0</Unavailable_x0028_NotGenerated_x0029_>
</_x0031_0_Instruments>
<_x0031_0_Instruments>
<InstrumentID>11</InstrumentID>
<InstrumentName>RCADS-25-Y-DA</InstrumentName>
<InstrumentFamily>1</InstrumentFamily>
<Language>4</Language>
<Informant>1</Informant>
<Deprecated>0</Deprecated>
<Authorized>1</Authorized>
<ReadRighttoLeft>0</ReadRighttoLeft>
<Unavailable_x0028_NotGenerated_x0029_>0</Unavailable_x0028_NotGenerated_x0029_>
</_x0031_0_Instruments>
<_x0031_0_Instruments>
<InstrumentID>12</InstrumentID>
<InstrumentName>RCADS-25-CG-DA</InstrumentName>
<InstrumentFamily>1</InstrumentFamily>
<Language>4</Language>
<Informant>2</Informant>
<Deprecated>0</Deprecated>
<Authorized>1</Authorized>
<ReadRighttoLeft>0</ReadRighttoLeft>
<Unavailable_x0028_NotGenerated_x0029_>0</Unavailable_x0028_NotGenerated_x0029_>
</_x0031_0_Instruments>
<_x0031_0_Instruments>
<InstrumentID>13</InstrumentID>
<InstrumentName>RCADS-47-Y-FR-FR-1</InstrumentName>
<InstrumentFamily>1</InstrumentFamily>
<Language>8</Language>
<Informant>1</Informant>
<Annotation>OG Bouvard version - has empirical study validating this version</Annotation>
<Deprecated>0</Deprecated>
<Authorized>0</Authorized>
<ReadRighttoLeft>0</ReadRighttoLeft>
<Unavailable_x0028_NotGenerated_x0029_>0</Unavailable_x0028_NotGenerated_x0029_>
</_x0031_0_Instruments>
<_x0031_0_Instruments>
<InstrumentID>14</InstrumentID>
<InstrumentName>RCADS-47-CG-FR-CA-1</InstrumentName>
<InstrumentFamily>1</InstrumentFamily>
<Language>8</Language>
<Informant>2</Informant>
<Annotation>Chantal Caron et al 2018</Annotation>
<Deprecated>1</Deprecated>
<Authorized>0</Authorized>
<ReadRighttoLeft>0</ReadRighttoLeft>
<Unavailable_x0028_NotGenerated_x0029_>0</Unavailable_x0028_NotGenerated_x0029_>
</_x0031_0_Instruments>
<_x0031_0_Instruments>
<InstrumentID>15</InstrumentID>
<InstrumentName>RCADS-25-Y-FR-FR-1</InstrumentName>
<InstrumentFamily>1</InstrumentFamily>
<Language>8</Language>
<Informant>1</Informant>
<Annotation>RCADS team generated</Annotation>
<Deprecated>0</Deprecated>
<Authorized>0</Authorized>
<ReadRighttoLeft>0</ReadRighttoLeft>
<Unavailable_x0028_NotGenerated_x0029_>0</Unavailable_x0028_NotGenerated_x0029_>
</_x0031_0_Instruments>
<_x0031_0_Instruments>
<InstrumentID>16</InstrumentID>
<InstrumentName>RCADS-25-CG-FR-FR-1</InstrumentName>
<InstrumentFamily>1</InstrumentFamily>
<Language>8</Language>
<Informant>2</Informant>
<Annotation>No items; Based on Boustani update of France French version</Annotation>
<Deprecated>1</Deprecated>
<Authorized>0</Authorized>
<ReadRighttoLeft>0</ReadRighttoLeft>
<Unavailable_x0028_NotGenerated_x0029_>1</Unavailable_x0028_NotGenerated_x0029_>
</_x0031_0_Instruments>
<_x0031_0_Instruments>
<InstrumentID>17</InstrumentID>
<InstrumentName>RCADS-47-Y-ES</InstrumentName>
<InstrumentFamily>1</InstrumentFamily>
<Language>21</Language>
<Informant>1</Informant>
<Deprecated>0</Deprecated>
<Authorized>0</Authorized>
<ReadRighttoLeft>0</ReadRighttoLeft>
<Unavailable_x0028_NotGenerated_x0029_>0</Unavailable_x0028_NotGenerated_x0029_>
</_x0031_0_Instruments>
<_x0031_0_Instruments>
<InstrumentID>18</InstrumentID>
<InstrumentName>RCADS-47-CG-ES</InstrumentName>
<InstrumentFamily>1</InstrumentFamily>
<Language>21</Language>
<Informant>2</Informant>
<Deprecated>0</Deprecated>
<Authorized>0</Authorized>
<ReadRighttoLeft>0</ReadRighttoLeft>
<Unavailable_x0028_NotGenerated_x0029_>0</Unavailable_x0028_NotGenerated_x0029_>
</_x0031_0_Instruments>
<_x0031_0_Instruments>
<InstrumentID>19</InstrumentID>
<InstrumentName>RCADS-25-Y-ES</InstrumentName>
<InstrumentFamily>1</InstrumentFamily>
<Language>21</Language>
<Informant>1</Informant>
<Deprecated>0</Deprecated>
<Authorized>0</Authorized>
<ReadRighttoLeft>0</ReadRighttoLeft>
<Unavailable_x0028_NotGenerated_x0029_>0</Unavailable_x0028_NotGenerated_x0029_>
</_x0031_0_Instruments>
<_x0031_0_Instruments>
<InstrumentID>20</InstrumentID>
<InstrumentName>RCADS-25-CG-ES</InstrumentName>
<InstrumentFamily>1</InstrumentFamily>
<Language>21</Language>
<Informant>2</Informant>
<Deprecated>0</Deprecated>
<Authorized>0</Authorized>
<ReadRighttoLeft>0</ReadRighttoLeft>
<Unavailable_x0028_NotGenerated_x0029_>0</Unavailable_x0028_NotGenerated_x0029_>
</_x0031_0_Instruments>
<_x0031_0_Instruments>
<InstrumentID>21</InstrumentID>
<InstrumentName>RCADS-47-Y-AR</InstrumentName>
<InstrumentFamily>1</InstrumentFamily>
<Language>2</Language>
<Informant>1</Informant>
<Deprecated>0</Deprecated>
<Authorized>0</Authorized>
<ReadRighttoLeft>1</ReadRighttoLeft>
<Unavailable_x0028_NotGenerated_x0029_>0</Unavailable_x0028_NotGenerated_x0029_>
</_x0031_0_Instruments>
<_x0031_0_Instruments>
<InstrumentID>22</InstrumentID>
<InstrumentName>RCADS-47-CG-AR</InstrumentName>
<InstrumentFamily>1</InstrumentFamily>
<Language>2</Language>
<Informant>2</Informant>
<Deprecated>0</Deprecated>
<Authorized>0</Authorized>
<ReadRighttoLeft>1</ReadRighttoLeft>
<Unavailable_x0028_NotGenerated_x0029_>0</Unavailable_x0028_NotGenerated_x0029_>
</_x0031_0_Instruments>
<_x0031_0_Instruments>
<InstrumentID>23</InstrumentID>
<InstrumentName>RCADS-25-Y-AR</InstrumentName>
<InstrumentFamily>1</InstrumentFamily>
<Language>2</Language>
<Informant>1</Informant>
<Deprecated>0</Deprecated>
<Authorized>0</Authorized>
<ReadRighttoLeft>1</ReadRighttoLeft>
<Unavailable_x0028_NotGenerated_x0029_>0</Unavailable_x0028_NotGenerated_x0029_>
</_x0031_0_Instruments>
<_x0031_0_Instruments>
<InstrumentID>24</InstrumentID>
<InstrumentName>RCADS-25-CG-AR</InstrumentName>
<InstrumentFamily>1</InstrumentFamily>
<Language>2</Language>
<Informant>2</Informant>
<Deprecated>0</Deprecated>
<Authorized>0</Authorized>
<ReadRighttoLeft>1</ReadRighttoLeft>